{
    "contract_version": "1.0.0",
    "specification_version": "1.0-draft.1",
    "target_profile": {
        "profile_id": "profile:pcre2/10.43",
        "profile_version": "1.3.0",
        "sha256": "56762a1d289d41d0811b007695464916fda0ca5c48c2f5569b4ec26983a24bff"
    },
    "portability_status": "native",
    "pattern": {
        "syntax": "regex",
        "encoding": "utf-8",
        "text": "(?<word>\\p{L}+)"
    },
    "engine_options": [
        {
            "option_id": "pcre2.matcher_api",
            "stage": "runtime",
            "value": "pcre2_match"
        },
        {
            "option_id": "pcre2.max_variable_lookbehind",
            "stage": "compile",
            "value": 255
        },
        {
            "option_id": "pcre2.multiline",
            "stage": "compile",
            "value": true
        },
        {
            "option_id": "pcre2.newline",
            "stage": "compile",
            "value": "any"
        },
        {
            "option_id": "pcre2.ucp",
            "stage": "compile",
            "value": true
        },
        {
            "option_id": "pcre2.utf",
            "stage": "compile",
            "value": true
        }
    ],
    "requirements": [
        {
            "requirement_id": "requirement:unicode.property",
            "capability_id": "character_properties.unicode",
            "status": "native",
            "resolution_code": "profile_option_satisfied"
        }
    ],
    "source_map": [
        {
            "generated_span": {
                "coordinate_system": "utf8-bytes",
                "start": 0,
                "end": 15
            },
            "node_ids": ["node:target.capture", "node:target.property"],
            "source_spans": [
                {
                    "source_id": "src:target.example",
                    "coordinate_system": "utf8-bytes",
                    "start": 0,
                    "end": 7
                }
            ]
        }
    ],
    "emission_diagnostics": [
        {
            "contract_version": "1.0.0",
            "occurrence": 0,
            "code": "STRL-EMIT-0003",
            "severity": "warning",
            "severity_basis": "target_profile",
            "phase": "emission",
            "category": "target_capability",
            "message": "Unicode property behavior requires the separately returned UTF and UCP compile options."
        }
    ]
}
